{
  "$id": "https://contracts.example.invalid/gk-ke/v1/KnowledgeMap.schema.json",
  "$schema": "https://json-schema.org/draft/2020-12/schema",
  "additionalProperties": false,
  "description": "独立候选交换剖面；SIM-only 示例约束，非现有生产合同替代。",
  "properties": {
    "contractVersion": {
      "const": "gk-ke/v1"
    },
    "edges": {
      "items": {
        "additionalProperties": false,
        "properties": {
          "designDecisionRef": {
            "minLength": 1,
            "type": "string"
          },
          "edgeId": {
            "minLength": 1,
            "type": "string"
          },
          "from": {
            "minLength": 1,
            "type": "string"
          },
          "reason": {
            "minLength": 1,
            "type": "string"
          },
          "relation": {
            "enum": [
              "requires",
              "optional",
              "uses",
              "dependsOn",
              "covers",
              "relatedTo"
            ],
            "type": "string"
          },
          "to": {
            "minLength": 1,
            "type": "string"
          }
        },
        "required": [
          "edgeId",
          "from",
          "to",
          "relation",
          "reason",
          "designDecisionRef"
        ],
        "type": "object"
      },
      "minItems": 1,
      "type": "array"
    },
    "entryNodes": {
      "items": {
        "minLength": 1,
        "type": "string"
      },
      "minItems": 1,
      "type": "array"
    },
    "mapId": {
      "minLength": 1,
      "type": "string"
    },
    "nodes": {
      "items": {
        "additionalProperties": false,
        "properties": {
          "label": {
            "minLength": 1,
            "type": "string"
          },
          "nodeId": {
            "minLength": 1,
            "type": "string"
          },
          "nodeType": {
            "enum": [
              "Task",
              "KnowledgeDomain",
              "Asset",
              "Capability"
            ],
            "type": "string"
          },
          "ref": {
            "additionalProperties": false,
            "properties": {
              "id": {
                "minLength": 1,
                "type": "string"
              },
              "version": {
                "pattern": "^\\d+\\.\\d+\\.\\d+$",
                "type": "string"
              }
            },
            "required": [
              "id",
              "version"
            ],
            "type": "object"
          }
        },
        "required": [
          "nodeId",
          "nodeType",
          "label",
          "ref"
        ],
        "type": "object"
      },
      "minItems": 1,
      "type": "array"
    },
    "purpose": {
      "enum": [
        "RESEARCH",
        "INTERPRETATION",
        "RECOMMENDATION"
      ],
      "type": "string"
    },
    "releaseId": {
      "minLength": 1,
      "type": "string"
    },
    "routePolicyRef": {
      "additionalProperties": false,
      "properties": {
        "id": {
          "minLength": 1,
          "type": "string"
        },
        "version": {
          "pattern": "^\\d+\\.\\d+\\.\\d+$",
          "type": "string"
        }
      },
      "required": [
        "id",
        "version"
      ],
      "type": "object"
    },
    "scope": {
      "additionalProperties": false,
      "properties": {
        "customerIds": {
          "items": {
            "minLength": 1,
            "type": "string"
          },
          "minItems": 0,
          "type": "array"
        },
        "orgIds": {
          "items": {
            "minLength": 1,
            "type": "string"
          },
          "minItems": 1,
          "type": "array"
        },
        "purpose": {
          "enum": [
            "RESEARCH",
            "INTERPRETATION",
            "RECOMMENDATION"
          ],
          "type": "string"
        },
        "tenantId": {
          "minLength": 1,
          "type": "string"
        }
      },
      "required": [
        "tenantId",
        "orgIds",
        "customerIds",
        "purpose"
      ],
      "type": "object"
    },
    "simulationOnly": {
      "const": true
    },
    "taskTypes": {
      "items": {
        "minLength": 1,
        "type": "string"
      },
      "minItems": 1,
      "type": "array"
    },
    "version": {
      "pattern": "^\\d+\\.\\d+\\.\\d+$",
      "type": "string"
    }
  },
  "required": [
    "contractVersion",
    "simulationOnly",
    "mapId",
    "version",
    "releaseId",
    "taskTypes",
    "entryNodes",
    "routePolicyRef",
    "nodes",
    "edges",
    "purpose",
    "scope"
  ],
  "title": "KnowledgeMap",
  "type": "object"
}
